Work ID,File Name,Work Agent,Work Title,Work Type,Work Material,Work Description,Work Measurements,Work Date,Work Location,GPSLatitude,GPSLongitude,Image Relation,Image Title,Image Work Type,Work Location Creation,Work Cultural Context,Work Style Period,Work Location Site,Collection,Image Rights,Image Source,Image URL
292,AR-MA-Bruzzone-Bustillo-Fernando-Papeles-marmolados-0292-00.jpg,"Bustillo, Fernando ",Papeles marmolados,,Tintas sobre papel,Manchas abstractas de diferentes colores,49 cm x 63.5 cm,1999 (creation),"Colección Bruzzone (Buenos Aires, Argentina) Inv. 292",-34599,-58380,"[imageOf 292, RAC Database]",Papeles marmolados,digital image,Argentina,Argentinean,Contemporary,"""Private Collection (Buenos Aires, Argentina)""",Colección Bruzzone,CC-BY Roberto Macchiavelli,https://museosabiertos.org/dam/,https://museosabiertos.org/dam/AR-MA-Bruzzone-Bustillo-Fernando-Papeles-marmolados-0292-00.jpg
1353,AR-MA-Bruzzone-Cabutti-Marcela-Move-In-1353-00.jpg,"Cabutti, Marcela",Move In,,Impreso sobre papel - Librillo,Secuencia de fotos de una mujer vomitando un conejo,16 cm x 10 cm,1999 (creation),"Colección Bruzzone (Buenos Aires, Argentina) Inv. 1353",-34599,-58380,"[imageOf 1353, RAC Database]",Move In,digital image,Argentina,Argentinean,Contemporary,"""Private Collection (Buenos Aires, Argentina)""",Colección Bruzzone,CC-BY Roberto Macchiavelli,https://museosabiertos.org/dam/,https://museosabiertos.org/dam/AR-MA-Bruzzone-Cabutti-Marcela-Move-In-1353-00.jpg
846,AR-MA-Bruzzone-Cabutti-Marcela-Pagoda-0846-00.jpg,"Cabutti, Marcela",Pagoda,,Escultura. Cristal soplado negro masilla epoxi,"Una edificación en negro con forma de pagoda, en llamas",56 cm x 29 cm x 23 cm,2010 (creation),"Colección Bruzzone (Buenos Aires, Argentina) Inv. 846",-34599,-58380,"[imageOf 846, RAC Database]",Pagoda,digital image,Argentina,Argentinean,Contemporary,"""Private Collection (Buenos Aires, Argentina)""",Colección Bruzzone,CC-BY Roberto Macchiavelli,https://museosabiertos.org/dam/,https://museosabiertos.org/dam/AR-MA-Bruzzone-Cabutti-Marcela-Pagoda-0846-00.jpg
587,AR-MA-Bruzzone-Cacchiarelli-Azar-Cartel-rojo-y-blanco-0587-00.jpg,"Cacchiarelli, Natalia; Azar, Amadeo",Cartel rojo y blanco,,Acuarela sobre papel,Un cartel a rayas en V en el medio del campo,35 cm x 50 cm,2007 (creation),"Colección Bruzzone (Buenos Aires, Argentina) Inv. 587",-34599,-58380,"[imageOf 587, RAC Database]",Cartel rojo y blanco,digital image,Argentina,Argentinean,Contemporary,"""Private Collection (Buenos Aires, Argentina)""",Colección Bruzzone,CC-BY Roberto Macchiavelli,https://museosabiertos.org/dam/,https://museosabiertos.org/dam/AR-MA-Bruzzone-Cacchiarelli-Azar-Cartel-rojo-y-blanco-0587-00.jpg
586,AR-MA-Bruzzone-Cacchiarelli-Azar-Sosteniendo-ladrillos-de-colores-0586-00.jpg,"Cacchiarelli, Natalia; Azar, Amadeo",Sosteniendo ladrillos de colores,,Acuarela sobre papel,"Una señora con delantal, sostiene un conjunto de ladrillos de colores",35 cm x 50 cm,2007 (creation),"Colección Bruzzone (Buenos Aires, Argentina) Inv. 586",-34599,-58380,"[imageOf 586, RAC Database]",Sosteniendo ladrillos de colores,digital image,Argentina,Argentinean,Contemporary,"""Private Collection (Buenos Aires, Argentina)""",Colección Bruzzone,CC-BY Roberto Macchiavelli,https://museosabiertos.org/dam/,https://museosabiertos.org/dam/AR-MA-Bruzzone-Cacchiarelli-Azar-Sosteniendo-ladrillos-de-colores-0586-00.jpg
465,AR-MA-Bruzzone-Cacchiarelli-Natalia-Caja-con-rayas-0465-00.jpg,"Cacchiarelli, Natalia ",Sin título. Caja con rayas,,Policromía sobre madera,Caja negra con tapa pintada con rayas,20 cm x 20 cm x 5 cm,ca. 1995- ca. 2010 (creation),"Colección Bruzzone (Buenos Aires, Argentina) Inv. 465",-34599,-58380,"[imageOf 465, RAC Database]",Sin título. Caja con rayas,digital image,Argentina,Argentinean,Contemporary,"""Private Collection (Buenos Aires, Argentina)""",Colección Bruzzone,CC-BY Roberto Macchiavelli,https://museosabiertos.org/dam/,https://museosabiertos.org/dam/AR-MA-Bruzzone-Cacchiarelli-Natalia-Caja-con-rayas-0465-00.jpg
126,AR-MA-Bruzzone-Cacchiarelli-Natalia-Lineas-0126-00.jpg,"Cacchiarelli, Natalia ",Sin título. Líneas,,Acrílico sobre tela,Líneas negras con fondo gris,10 cm x 10 cm,2002 (creation),"Colección Bruzzone (Buenos Aires, Argentina) Inv. 126",-34599,-58380,"[imageOf 126, RAC Database]",Sin título. Líneas,digital image,Argentina,Argentinean,Contemporary,"""Private Collection (Buenos Aires, Argentina)""",Colección Bruzzone,CC-BY Roberto Macchiavelli,https://museosabiertos.org/dam/,https://museosabiertos.org/dam/AR-MA-Bruzzone-Cacchiarelli-Natalia-Lineas-0126-00.jpg
1031,AR-MA-Bruzzone-Cacchiarelli-Natalia-Pasillo-1031-00.jpg,"Cacchiarelli, Natalia ",Pasillo,,Acuarela sobre papel,Cuadrados concéntricos fugando hacia la izquierda,20 cm x 20 cm,2012 (creation),"Colección Bruzzone (Buenos Aires, Argentina) Inv. 1031",-34599,-58380,"[imageOf 1031, RAC Database]",Pasillo,digital image,Argentina,Argentinean,Contemporary,"""Private Collection (Buenos Aires, Argentina)""",Colección Bruzzone,CC-BY Roberto Macchiavelli,https://museosabiertos.org/dam/,https://museosabiertos.org/dam/AR-MA-Bruzzone-Cacchiarelli-Natalia-Pasillo-1031-00.jpg
127,AR-MA-Bruzzone-Cacchiarelli-Natalia-Pequenito-0127-00.jpg,"Cacchiarelli, Natalia ",Pequeñito,,Mixta sobre tela,"Geométrico, rayas",12.5 cm (diameter),2001 (creation),"Colección Bruzzone (Buenos Aires, Argentina) Inv. 127",-34599,-58380,"[imageOf 127, RAC Database]",Pequeñito,digital image,Argentina,Argentinean,Contemporary,"""Private Collection (Buenos Aires, Argentina)""",Colección Bruzzone,CC-BY Roberto Macchiavelli,https://museosabiertos.org/dam/,https://museosabiertos.org/dam/AR-MA-Bruzzone-Cacchiarelli-Natalia-Pequenito-0127-00.jpg
623,AR-MA-Bruzzone-Cacchiarelli-Natalia-Rayas-celestes-0623-00.jpg,"Cacchiarelli, Natalia ",Rayas celestes,,Témpera sobre papel,Rayas paralelas,13 cm x 18 cm,ca. 1995- ca. 2010 (creation),"Colección Bruzzone (Buenos Aires, Argentina) Inv. 623",-34599,-58380,"[imageOf 623, RAC Database]",Rayas celestes,digital image,Argentina,Argentinean,Contemporary,"""Private Collection (Buenos Aires, Argentina)""",Colección Bruzzone,CC-BY Roberto Macchiavelli,https://museosabiertos.org/dam/,https://museosabiertos.org/dam/AR-MA-Bruzzone-Cacchiarelli-Natalia-Rayas-celestes-0623-00.jpg
596,AR-MA-Bruzzone-Cacchiarelli-Natalia-Rayas-con-profundidad-0596-00.jpg,"Cacchiarelli, Natalia ",Rayas con profundidad,,Témpera sobre papel,"Rayas paralelas, en profundidad",60 cm x 120 cm,ca. 1995- ca. 2010 (creation),"Colección Bruzzone (Buenos Aires, Argentina) Inv. 596",-34599,-58380,"[imageOf 596, RAC Database]",Rayas con profundidad,digital image,Argentina,Argentinean,Contemporary,"""Private Collection (Buenos Aires, Argentina)""",Colección Bruzzone,CC-BY Roberto Macchiavelli,https://museosabiertos.org/dam/,https://museosabiertos.org/dam/AR-MA-Bruzzone-Cacchiarelli-Natalia-Rayas-con-profundidad-0596-00.jpg
534,AR-MA-Bruzzone-Cacchiarelli-Natalia-Rayas-de-colores-I-0534-00.jpg,"Cacchiarelli, Natalia ",Rayas de colores I,,AcrÌlico sobre tela,Rayas de colores paralelas colocadas en vertical,33 cm x 66 cm,2006 (creation),"Colección Bruzzone (Buenos Aires, Argentina) Inv. 534",-34599,-58380,"[imageOf 534, RAC Database]",Rayas de colores I,digital image,Argentina,Argentinean,Contemporary,"""Private Collection (Buenos Aires, Argentina)""",Colección Bruzzone,CC-BY Roberto Macchiavelli,https://museosabiertos.org/dam/,https://museosabiertos.org/dam/AR-MA-Bruzzone-Cacchiarelli-Natalia-Rayas-de-colores-I-0534-00.jpg
535,AR-MA-Bruzzone-Cacchiarelli-Natalia-Rayas-de-colores-II-0535-00.jpg,"Cacchiarelli, Natalia ",Rayas de colores II,,AcrÌlico sobre tela,"Rayas de colores en la gama de los grises, paralelas colocadas en vertical",33 cm x 66 cm,2006 (creation),"Colección Bruzzone (Buenos Aires, Argentina) Inv. 535",-34599,-58380,"[imageOf 535, RAC Database]",Rayas de colores II,digital image,Argentina,Argentinean,Contemporary,"""Private Collection (Buenos Aires, Argentina)""",Colección Bruzzone,CC-BY Roberto Macchiavelli,https://museosabiertos.org/dam/,https://museosabiertos.org/dam/AR-MA-Bruzzone-Cacchiarelli-Natalia-Rayas-de-colores-II-0535-00.jpg
1316,AR-MA-Bruzzone-Cacchiarelli-Natalia-Torres-1316-00.jpg,"Cacchiarelli, Natalia ",Sin título - Torres,,Pintura sobre tela. Tríptico,Rayas negras sobre fondo naranja,10 cm x 10 cm; 52 cm x 6.5 cm; 52.5 cm x 6.5 cm,ca. 1995- ca. 2010 (creation),"Colección Bruzzone (Buenos Aires, Argentina) Inv. 1316",-34599,-58380,"[imageOf 1316, RAC Database]",Sin título - Torres,digital image,Argentina,Argentinean,Contemporary,"""Private Collection (Buenos Aires, Argentina)""",Colección Bruzzone,CC-BY Roberto Macchiavelli,https://museosabiertos.org/dam/,https://museosabiertos.org/dam/AR-MA-Bruzzone-Cacchiarelli-Natalia-Torres-1316-00.jpg
1023,AR-MA-Bruzzone-Caccia-Isabel-Flotar-1023-00.jpg,"Caccia, Isabel",Flotar,,Técnica mixta - Objeto intervenido,"Una media con un hilo con trozos de tela: en el interior de la misma, más trozos de tela, uno mayor con la palabra “Flotar”",approximately 70 cm x 8 cm (irregular),ca. 1995- ca. 2010 (creation),"Colección Bruzzone (Buenos Aires, Argentina) Inv. 1023",-34599,-58380,"[imageOf 1023, RAC Database]",Flotar,digital image,Argentina,Argentinean,Contemporary,"""Private Collection (Buenos Aires, Argentina)""",Colección Bruzzone,CC-BY Roberto Macchiavelli,https://museosabiertos.org/dam/,https://museosabiertos.org/dam/AR-MA-Bruzzone-Caccia-Isabel-Flotar-1023-00.jpg
761,AR-MA-Bruzzone-Caccia-Isabel-Licores-de-Isa-0761-00.jpg,"Caccia, Isabel",Licores de Isa,,Instalación,"Conjunto de diferentes botellas con líquidos y en las tapas, cintas y trapos",40cm x 30 cm x 32cm (height),1997 (creation),"Colección Bruzzone (Buenos Aires, Argentina) Inv. 761",-34599,-58380,"[imageOf 761, RAC Database]",Licores de Isa,digital image,Argentina,Argentinean,Contemporary,"""Private Collection (Buenos Aires, Argentina)""",Colección Bruzzone,CC-BY Roberto Macchiavelli,https://museosabiertos.org/dam/,https://museosabiertos.org/dam/AR-MA-Bruzzone-Caccia-Isabel-Licores-de-Isa-0761-00.jpg
491,AR-MA-Bruzzone-Cacciabue-Florencia-Escuela-0491-00.jpg,"Cacciabue, Florencia",Escuela,,Escultura,Casa con puerta y ventanas con cartel con leyenda “Escuela” y Bandera Argentina,10 cm x 8.5 cm x 5 cm,2002 (creation),"Colección Bruzzone (Buenos Aires, Argentina) Inv. 491",-34599,-58380,"[imageOf 491, RAC Database]",Escuela,digital image,Argentina,Argentinean,Contemporary,"""Private Collection (Buenos Aires, Argentina)""",Colección Bruzzone,CC-BY Roberto Macchiavelli,https://museosabiertos.org/dam/,https://museosabiertos.org/dam/AR-MA-Bruzzone-Cacciabue-Florencia-Escuela-0491-00.jpg
490,AR-MA-Bruzzone-Cacciabue-Florencia-Guggenheim-0490-00.jpg,"Cacciabue, Florencia",Guggenheim,,Escultura,Casa con puerta y ventana con cartel rojo y negro con leyenda “Guggenheim”,12 cm x 9 cm x 5 cm,2002 (creation),"Colección Bruzzone (Buenos Aires, Argentina) Inv. 490",-34599,-58380,"[imageOf 490, RAC Database]",Guggenheim,digital image,Argentina,Argentinean,Contemporary,"""Private Collection (Buenos Aires, Argentina)""",Colección Bruzzone,CC-BY Roberto Macchiavelli,https://museosabiertos.org/dam/,https://museosabiertos.org/dam/AR-MA-Bruzzone-Cacciabue-Florencia-Guggenheim-0490-00.jpg
385,AR-MA-Bruzzone-Calcarami-Juan-Galerista-Rica-0385-00.jpg,"Calcarami, Juan",Galerista Rica,,Oleo sobre cartón,"Personaje gordo con obras de Suárez, Pombo y Harte expuestas a su espalda",69 cm x 99 cm,2000 (creation),"Colección Bruzzone (Buenos Aires, Argentina) Inv. 385",-34599,-58380,"[imageOf 385, RAC Database]",Galerista Rica,digital image,Argentina,Argentinean,Contemporary,"""Private Collection (Buenos Aires, Argentina)""",Colección Bruzzone,CC-BY Roberto Macchiavelli,https://museosabiertos.org/dam/,https://museosabiertos.org/dam/AR-MA-Bruzzone-Calcarami-Juan-Galerista-Rica-0385-00.jpg
1033,AR-MA-Bruzzone-Calcarami-Juan-La-Age-Vive-Homenaje-1033-00.jpg,"Calcarami, Juan",La Age Vive (Homenaje),,Revista. Técnica mixta. Diferentes técnicas sobre papel,"Homenaje a Juan Calcarami luego de su muerte, completando su proyecto inconcluso de una revista de participación libre. Varios artistas participan del homenaje, colaborando y difundiendo obras en la revista",30 cm x 23 cm,2002 (creation),"Colección Bruzzone (Buenos Aires, Argentina) Inv. 1033",-34599,-58380,"[imageOf 1033, RAC Database]",La Age Vive (Homenaje),digital image,Argentina,Argentinean,Contemporary,"""Private Collection (Buenos Aires, Argentina)""",Colección Bruzzone,CC-BY Roberto Macchiavelli,https://museosabiertos.org/dam/,https://museosabiertos.org/dam/AR-MA-Bruzzone-Calcarami-Juan-La-Age-Vive-Homenaje-1033-00.jpg
1046,AR-MA-Bruzzone-Calcarami-Juan-La-Age-Vive-Homenaje-1046-00.jpg,"Calcarami, Juan",La Age Vive (Homenaje),,Revista. Técnica mixta. Diferentes técnicas sobre papel,"Homenaje a Juan Calcarami luego de su muerte, completando su proyecto inconcluso de una revista de participación libre. Varios artistas participan del homenaje, colaborando y difundiendo obras en la revista",30 cm x 23 cm,2002 (creation),"Colección Bruzzone (Buenos Aires, Argentina) Inv. 1046",-34599,-58380,"[imageOf 1046, RAC Database]",La Age Vive (Homenaje),digital image,Argentina,Argentinean,Contemporary,"""Private Collection (Buenos Aires, Argentina)""",Colección Bruzzone,CC-BY Roberto Macchiavelli,https://museosabiertos.org/dam/,https://museosabiertos.org/dam/AR-MA-Bruzzone-Calcarami-Juan-La-Age-Vive-Homenaje-1046-00.jpg
388,AR-MA-Bruzzone-Canal-Feijoo-Ana-Lia-Desnudo-0388-00.jpg,"Canal Feijóo, Ana Lía ",Desnudo,,"Grafito, sobre papel | lápiz de color [300022441], lápiz de grafito [300022443]",Mujer desnuda con el pelo largo al viento,26 cm x 48 cm,1997 (creation),"Colección Bruzzone (Buenos Aires, Argentina) Inv. 388",-34599,-58380,"[imageOf 388, RAC Database]",Desnudo,digital image,Argentina,Argentinean,Contemporary,"""Private Collection (Buenos Aires, Argentina)""",Colección Bruzzone,CC-BY Roberto Macchiavelli,https://museosabiertos.org/dam/,https://museosabiertos.org/dam/AR-MA-Bruzzone-Canal-Feijoo-Ana-Lia-Desnudo-0388-00.jpg
389,AR-MA-Bruzzone-Canal-Feijoo-Ana-Lia-Paseo-por-el-bosque-0389-00.jpg,"Canal Feijóo, Ana Lía ",Paseo por el bosque,,Témpera sobre papel,Dos mujeres abrazadas paseando por un bosque,22 cm x 28 cm,1993 (creation),"Colección Bruzzone (Buenos Aires, Argentina) Inv. 389",-34599,-58380,"[imageOf 389, RAC Database]",Paseo por el bosque,digital image,Argentina,Argentinean,Contemporary,"""Private Collection (Buenos Aires, Argentina)""",Colección Bruzzone,CC-BY Roberto Macchiavelli,https://museosabiertos.org/dam/,https://museosabiertos.org/dam/AR-MA-Bruzzone-Canal-Feijoo-Ana-Lia-Paseo-por-el-bosque-0389-00.jpg
1987,AR-MA-Bruzzone-Canardo-Juana-Autorretrato-1987-00.jpg,"Cañardo, Juana",Autorretrato,,Pintura sobre papel. Cartulina,Autorretrato. En reverso paisaje abstracto,12 cm x 17 cm,2021 (creation),"Colección Bruzzone (Buenos Aires, Argentina) Inv. 1987",-34599,-58380,"[imageOf 1987, RAC Database]",Autorretrato,digital image,Argentina,Argentinean,Contemporary,"""Private Collection (Buenos Aires, Argentina)""",Colección Bruzzone,CC-BY Roberto Macchiavelli,https://museosabiertos.org/dam/,https://museosabiertos.org/dam/AR-MA-Bruzzone-Canardo-Juana-Autorretrato-1987-00.jpg
1704,AR-MA-Bruzzone-Canardo-Juana-Los-numeros-de-los-suenos-Tanda-1-1704-00.jpg,"Cañardo, Juana",Los números de los sueños,,"Dibujos. Mixta sobre papel. pastel graso, pintura | lápiz de color [300022441]",8 Representaciones de los números de los sueños,17 cm x 12 cm (each),2019 (creation),"Colección Bruzzone (Buenos Aires, Argentina) Inv. 1704",-34599,-58380,"[imageOf 1704, RAC Database]",Los números de los sueños,digital image,Argentina,Argentinean,Contemporary,"""Private Collection (Buenos Aires, Argentina)""",Colección Bruzzone,CC-BY Roberto Macchiavelli,https://museosabiertos.org/dam/,https://museosabiertos.org/dam/AR-MA-Bruzzone-Canardo-Juana-Los-numeros-de-los-suenos-Tanda-1-1704-00.jpg
1726,AR-MA-Bruzzone-Canardo-Juana-Los-numeros-de-los-suenos-Tanda-2-1726-00.jpg,"Cañardo, Juana",Los números de los sueños ñ Segunda Entrega,,"Dibujos. Mixta sobre papel. pastel graso, pintura | lápiz de color [300022441]",5 Representaciones de los números de los sueños,17 cm x 12 cm (each),2019 (creation),"Colección Bruzzone (Buenos Aires, Argentina) Inv. 1726",-34599,-58380,"[imageOf 1726, RAC Database]",Los números de los sueños ñ Segunda Entrega,digital image,Argentina,Argentinean,Contemporary,"""Private Collection (Buenos Aires, Argentina)""",Colección Bruzzone,CC-BY Roberto Macchiavelli,https://museosabiertos.org/dam/,https://museosabiertos.org/dam/AR-MA-Bruzzone-Canardo-Juana-Los-numeros-de-los-suenos-Tanda-2-1726-00.jpg
1763,AR-MA-Bruzzone-Canardo-Juana-Los-numeros-de-los-suenos-Tanda-3-1763-00.jpg,"Cañardo, Juana",Los números de los sueños-Tercera Entrega,,"Dibujos. Mixta sobre papel. pastel graso, pintura | lápiz de color [300022441]",7 Representaciones de los números de los sueños,17 cm x 12 cm (each),2019 (creation),"Colección Bruzzone (Buenos Aires, Argentina) Inv. 1763",-34599,-58380,"[imageOf 1763, RAC Database]",Los números de los sueños-Tercera Entrega,digital image,Argentina,Argentinean,Contemporary,"""Private Collection (Buenos Aires, Argentina)""",Colección Bruzzone,CC-BY Roberto Macchiavelli,https://museosabiertos.org/dam/,https://museosabiertos.org/dam/AR-MA-Bruzzone-Canardo-Juana-Los-numeros-de-los-suenos-Tanda-3-1763-00.jpg
1811,AR-MA-Bruzzone-Canardo-Juana-Los-numeros-de-los-suenos-Tanda-4-1811-00.jpg,"Cañardo, Juana",Los números de los sueños-Cuarta Entrega,,"Dibujos. Mixta sobre papel. pastel graso, pintura | lápiz de color [300022441]",8 Representaciones de los números de los sueños,17 cm x 12 cm (each),2019 (creation),"Colección Bruzzone (Buenos Aires, Argentina) Inv. 1811",-34599,-58380,"[imageOf 1811, RAC Database]",Los números de los sueños-Cuarta Entrega,digital image,Argentina,Argentinean,Contemporary,"""Private Collection (Buenos Aires, Argentina)""",Colección Bruzzone,CC-BY Roberto Macchiavelli,https://museosabiertos.org/dam/,https://museosabiertos.org/dam/AR-MA-Bruzzone-Canardo-Juana-Los-numeros-de-los-suenos-Tanda-4-1811-00.jpg
1847,AR-MA-Bruzzone-Canardo-Juana-Los-numeros-de-los-suenos-Tanda-5-1847-00.jpg,"Cañardo, Juana",Los números de los sueños-Quinta Entrega,,"Dibujos. Mixta sobre papel. pastel graso, pintura | lápiz de color [300022441]",9 Representaciones de los números de los sueños,17 cm x 12 cm (each),2019-2020 (creation),"Colección Bruzzone (Buenos Aires, Argentina) Inv. 1847",-34599,-58380,"[imageOf 1847, RAC Database]",Los números de los sueños-Quinta Entrega,digital image,Argentina,Argentinean,Contemporary,"""Private Collection (Buenos Aires, Argentina)""",Colección Bruzzone,CC-BY Roberto Macchiavelli,https://museosabiertos.org/dam/,https://museosabiertos.org/dam/AR-MA-Bruzzone-Canardo-Juana-Los-numeros-de-los-suenos-Tanda-5-1847-00.jpg
1889,AR-MA-Bruzzone-Canardo-Juana-Los-numeros-de-los-suenos-Tanda-6-1889-00.jpg,"Cañardo, Juana",Los números de los sueños-Sexta Entrega,,"Dibujos. Mixta sobre papel. pastel graso, pintura | lápiz de color [300022441]",14 Representaciones de los números de los sueños,17 cm x 12 cm (each),2020 (creation),"Colección Bruzzone (Buenos Aires, Argentina) Inv. 1889",-34599,-58380,"[imageOf 1889, RAC Database]",Los números de los sueños-Sexta Entrega,digital image,Argentina,Argentinean,Contemporary,"""Private Collection (Buenos Aires, Argentina)""",Colección Bruzzone,CC-BY Roberto Macchiavelli,https://museosabiertos.org/dam/,https://museosabiertos.org/dam/AR-MA-Bruzzone-Canardo-Juana-Los-numeros-de-los-suenos-Tanda-6-1889-00.jpg
2016,AR-MA-Bruzzone-Canardo-Juana-Retrato-Gustavo-Bruzzone-2016-00.jpg,"Cañardo, Juana",Retrato Gustavo Bruzzone,,"Dibujos. Mixta sobre papel. pastel graso, pintura | lápiz de color [300022441]",Retrato de frente y con lentes de Gustavo Bruzzone,17 cm x 12 cm,2021 (creation),"Colección Bruzzone (Buenos Aires, Argentina) Inv. 2016",-34599,-58380,"[imageOf 2016, RAC Database]",Retrato Gustavo Bruzzone,digital image,Argentina,Argentinean,Contemporary,"""Private Collection (Buenos Aires, Argentina)""",Colección Bruzzone,CC-BY Roberto Macchiavelli,https://museosabiertos.org/dam/,https://museosabiertos.org/dam/AR-MA-Bruzzone-Canardo-Juana-Retrato-Gustavo-Bruzzone-2016-00.jpg
1709,AR-MA-Bruzzone-Canardo-Juana-Una-luz-en-el-camino-1-1709-00.jpg,"Cañardo, Juana",Una luz en el camino 1,,Mixta sobre papel. Pastel graso y témpera,Dos personajes de negro recostados sobre el pasto,15 cm x 21 cm,2018 (creation),"Colección Bruzzone (Buenos Aires, Argentina) Inv. 1709",-34599,-58380,"[imageOf 1709, RAC Database]",Una luz en el camino 1,digital image,Argentina,Argentinean,Contemporary,"""Private Collection (Buenos Aires, Argentina)""",Colección Bruzzone,CC-BY Roberto Macchiavelli,https://museosabiertos.org/dam/,https://museosabiertos.org/dam/AR-MA-Bruzzone-Canardo-Juana-Una-luz-en-el-camino-1-1709-00.jpg
1710,AR-MA-Bruzzone-Canardo-Juana-Una-luz-en-el-camino-2-1710-00.jpg,"Cañardo, Juana",Una luz en el camino 2,,Mixta sobre papel. Pastel graso y témpera,Dos personajes de negro sentados en un banco de plaza,15 cm x 21 cm,2018 (creation),"Colección Bruzzone (Buenos Aires, Argentina) Inv. 1710",-34599,-58380,"[imageOf 1710, RAC Database]",Una luz en el camino 2,digital image,Argentina,Argentinean,Contemporary,"""Private Collection (Buenos Aires, Argentina)""",Colección Bruzzone,CC-BY Roberto Macchiavelli,https://museosabiertos.org/dam/,https://museosabiertos.org/dam/AR-MA-Bruzzone-Canardo-Juana-Una-luz-en-el-camino-2-1710-00.jpg
1711,AR-MA-Bruzzone-Canardo-Juana-Una-luz-en-el-camino-3-1711-00.jpg,"Cañardo, Juana",Una luz en el camino 3,,Mixta sobre papel. Pastel graso y témpera,Cuatro personajes de negro con un gato,15 cm x 21 cm,2018 (creation),"Colección Bruzzone (Buenos Aires, Argentina) Inv. 1711",-34599,-58380,"[imageOf 1711, RAC Database]",Una luz en el camino 3,digital image,Argentina,Argentinean,Contemporary,"""Private Collection (Buenos Aires, Argentina)""",Colección Bruzzone,CC-BY Roberto Macchiavelli,https://museosabiertos.org/dam/,https://museosabiertos.org/dam/AR-MA-Bruzzone-Canardo-Juana-Una-luz-en-el-camino-3-1711-00.jpg
1712,AR-MA-Bruzzone-Canardo-Juana-Una-luz-en-el-camino-4-1712-00.jpg,"Cañardo, Juana",Una luz en el camino 4,,Mixta sobre papel. Pastel graso y témpera,"Cuatro personajes de negro, dos besándose recostados y dos abrazándose sentados, todos en un parque",15 cm x 21 cm,2018 (creation),"Colección Bruzzone (Buenos Aires, Argentina) Inv. 1712",-34599,-58380,"[imageOf 1712, RAC Database]",Una luz en el camino 4,digital image,Argentina,Argentinean,Contemporary,"""Private Collection (Buenos Aires, Argentina)""",Colección Bruzzone,CC-BY Roberto Macchiavelli,https://museosabiertos.org/dam/,https://museosabiertos.org/dam/AR-MA-Bruzzone-Canardo-Juana-Una-luz-en-el-camino-4-1712-00.jpg
1904,AR-MA-Bruzzone-Canevari-Marcelo-Nuestro-ultimo-campamento-1904-00.jpg,"Canevari, Marcelo",Nuestro último campamento,,Acrílico sobre tela,"Una carpa con dos personas dentro, en un bosque, rodeada por cinco fantasmas. En primer plano una olla sobre una fogata",80 cm x 120 cm,2018 (creation),"Colección Bruzzone (Buenos Aires, Argentina) Inv. 1904",-34599,-58380,"[imageOf 1904, RAC Database]",Nuestro último campamento,digital image,Argentina,Argentinean,Contemporary,"""Private Collection (Buenos Aires, Argentina)""",Colección Bruzzone,CC-BY Roberto Macchiavelli,https://museosabiertos.org/dam/,https://museosabiertos.org/dam/AR-MA-Bruzzone-Canevari-Marcelo-Nuestro-ultimo-campamento-1904-00.jpg
1334,AR-MA-Bruzzone-Cantera-Maria-Laren-1334-00.jpg,"Cantera, María",Laren,,Dibujo sobre papel,"Benito Laren, retratado asomado tras una cortina",24.5 cm x 34.5 cm,ca. 1995- ca. 2010 (creation),"Colección Bruzzone (Buenos Aires, Argentina) Inv. 1334",-34599,-58380,"[imageOf 1334, RAC Database]",Laren,digital image,Argentina,Argentinean,Contemporary,"""Private Collection (Buenos Aires, Argentina)""",Colección Bruzzone,CC-BY Roberto Macchiavelli,https://museosabiertos.org/dam/,https://museosabiertos.org/dam/AR-MA-Bruzzone-Cantera-Maria-Laren-1334-00.jpg
1478,AR-MA-Bruzzone-Cantini-Esmeralda-Bianchi-Tatu-Carreta-1478-00.jpg,"Cantini, Federico; Bianchi, Esmeralda",Tatú Carreta,,Video. Formato mp4,Una nena (Esmeralda) tatuando en la espalda a un hombre (Federico),989 MB,2016 (creation),"Colección Bruzzone (Buenos Aires, Argentina) Inv. 1478",-34599,-58380,"[imageOf 1478, RAC Database]",Tatú Carreta,digital image,Argentina,Argentinean,Contemporary,"""Private Collection (Buenos Aires, Argentina)""",Colección Bruzzone,CC-BY Roberto Macchiavelli,https://museosabiertos.org/dam/,https://museosabiertos.org/dam/AR-MA-Bruzzone-Cantini-Esmeralda-Bianchi-Tatu-Carreta-1478-00.jpg
902,AR-MA-Bruzzone-Caram-Jubal-Escenas-de-suicidio-0902-00.jpg,"Caram, Jubal",Escenas de suicidio,,Xilografía sobre papel,Cuatro escenas de un personaje suicidándose de diferentes maneras,23 cm x 17 cm; 10.5 cm x 7.5 cm (each),2001 (creation),"Colección Bruzzone (Buenos Aires, Argentina) Inv. 902",-34599,-58380,"[imageOf 902, RAC Database]",Escenas de suicidio,digital image,Argentina,Argentinean,Contemporary,"""Private Collection (Buenos Aires, Argentina)""",Colección Bruzzone,CC-BY Roberto Macchiavelli,https://museosabiertos.org/dam/,https://museosabiertos.org/dam/AR-MA-Bruzzone-Caram-Jubal-Escenas-de-suicidio-0902-00.jpg
