Work ID,File Name,Work Agent,Work Title,Work Type,Work Material,Work Description,Work Measurements,Work Date,Work Location,GPSLatitude,GPSLongitude,Image Relation,Image Title,Image Work Type,Work Location Creation,Work Cultural Context,Work Style Period,Work Location Site,Collection,Image Rights,Image Source,Image URL
1760,AR-MA-Bruzzone-Cardozo-Linares-Pol-Nada-La-San-Llamarada-1760-00.jpg,"Cardozo, Linares",Pol Nada La San Llamarada,,Grabación de audio. Impreso sobre cartulina,CD con 8 canciones,18.5 cm x 18.5 cm,2014-2016 (creation),"Colección Bruzzone (Buenos Aires, Argentina) Inv. 1760",-34599,-58380,"[imageOf 1760, RAC Database]",Pol Nada La San Llamarada,digital image,Argentina,Argentinean,Contemporary,"""Private Collection (Buenos Aires, Argentina)""",Colección Bruzzone,CC-BY Roberto Macchiavelli,https://museosabiertos.org/dam/,https://museosabiertos.org/dam/AR-MA-Bruzzone-Cardozo-Linares-Pol-Nada-La-San-Llamarada-1760-00.jpg
36,AR-MA-Bruzzone-Caro-Antonio-Colombia-0036-00.jpg,"Caro, Antonio",Colombia,,Impreso sobre papel,"Palabra “Colombia”, al estilo de Coca Cola",34 cm x 43 cm,1976 (creation),"Colección Bruzzone (Buenos Aires, Argentina) Inv. 36",-34599,-58380,"[imageOf 36, RAC Database]",Colombia,digital image,Argentina,Argentinean,Contemporary,"""Private Collection (Buenos Aires, Argentina)""",Colección Bruzzone,CC-BY Roberto Macchiavelli,https://museosabiertos.org/dam/,https://museosabiertos.org/dam/AR-MA-Bruzzone-Caro-Antonio-Colombia-0036-00.jpg
1905,AR-MA-Bruzzone-Carton-Pintado-La-siesta-de-los-gatos-1905-00.jpg,Cartón Pintado (Argentinian artist collective),La siesta de los gatos,,"Mixta sobre cartón. Pintura, aro de fantasía. Cartón industrial","Una persona con aro y tatuaje, durmiendo con tres gatos",95 cm x 137 cm,2018 (creation),"Colección Bruzzone (Buenos Aires, Argentina) Inv. 1905",-34599,-58380,"[imageOf 1905, RAC Database]",La siesta de los gatos,digital image,Argentina,Argentinean,Contemporary,"""Private Collection (Buenos Aires, Argentina)""",Colección Bruzzone,CC-BY Roberto Macchiavelli,https://museosabiertos.org/dam/,https://museosabiertos.org/dam/AR-MA-Bruzzone-Carton-Pintado-La-siesta-de-los-gatos-1905-00.jpg
835,AR-MA-Bruzzone-Cartonera-Durazno-reverdeciente-0835-00.jpg,Eloísa Cartonera (Buenos Aires artist collective),Durazno reverdeciente de Fernanda Laguna & Dalia Rossetti,,Libro hecho a mano,Libro con tapas de cartón conteniendo un cuento,22.5 cm x 15.5 cm,2003 (creation),"Colección Bruzzone (Buenos Aires, Argentina) Inv. 835",-34599,-58380,"[imageOf 835, RAC Database]",Durazno reverdeciente de Fernanda Laguna & Dalia Rossetti,digital image,Argentina,Argentinean,Contemporary,"""Private Collection (Buenos Aires, Argentina)""",Colección Bruzzone,CC-BY Roberto Macchiavelli,https://museosabiertos.org/dam/,https://museosabiertos.org/dam/AR-MA-Bruzzone-Cartonera-Durazno-reverdeciente-0835-00.jpg
831,AR-MA-Bruzzone-Cartonera-El-Bosque-Pulenta-0831-00.jpg,Eloísa Cartonera (Buenos Aires artist collective),El Bosque Pulenta de Fabián Casas,,Libro hecho a mano,Libro con tapas de cartón conteniendo un cuento,22.5 cm x 16 cm,2003 (creation),"Colección Bruzzone (Buenos Aires, Argentina) Inv. 831",-34599,-58380,"[imageOf 831, RAC Database]",El Bosque Pulenta de Fabián Casas,digital image,Argentina,Argentinean,Contemporary,"""Private Collection (Buenos Aires, Argentina)""",Colección Bruzzone,CC-BY Roberto Macchiavelli,https://museosabiertos.org/dam/,https://museosabiertos.org/dam/AR-MA-Bruzzone-Cartonera-El-Bosque-Pulenta-0831-00.jpg
833,AR-MA-Bruzzone-Cartonera-El-Bosque-Pulenta-Pendejo-0833-00.jpg,Eloísa Cartonera (Buenos Aires artist collective),El Bosque Pulenta de Fabián Casas - Pendejo,,Libro hecho a mano,Libro con tapas de cartón conteniendo un cuento,24.5 cm x 16 cm,2003 (creation),"Colección Bruzzone (Buenos Aires, Argentina) Inv. 833",-34599,-58380,"[imageOf 833, RAC Database]",El Bosque Pulenta de Fabián Casas - Pendejo,digital image,Argentina,Argentinean,Contemporary,"""Private Collection (Buenos Aires, Argentina)""",Colección Bruzzone,CC-BY Roberto Macchiavelli,https://museosabiertos.org/dam/,https://museosabiertos.org/dam/AR-MA-Bruzzone-Cartonera-El-Bosque-Pulenta-Pendejo-0833-00.jpg
1454,AR-MA-Bruzzone-Cartonera-eloisa-Cartonera-1454-00.jpg,Eloísa Cartonera (Buenos Aires artist collective),eloisa CARTONERA,,Librillo,Explicación de qué es Eloísa Cartonera para ArteBA 2004,15.5 cm x 11.5 cm,2004 (creation),"Colección Bruzzone (Buenos Aires, Argentina) Inv. 1454",-34599,-58380,"[imageOf 1454, RAC Database]",eloisa CARTONERA,digital image,Argentina,Argentinean,Contemporary,"""Private Collection (Buenos Aires, Argentina)""",Colección Bruzzone,CC-BY Roberto Macchiavelli,https://museosabiertos.org/dam/,https://museosabiertos.org/dam/AR-MA-Bruzzone-Cartonera-eloisa-Cartonera-1454-00.jpg
836,AR-MA-Bruzzone-Cartonera-Fer-0836-00.jpg,Eloísa Cartonera (Buenos Aires artist collective),Fer - Fernanda Laguna,,Libro hecho a mano,Libro con tapas de cartón conteniendo un cuento,24 cm x 17 cm,2003 (creation),"Colección Bruzzone (Buenos Aires, Argentina) Inv. 836",-34599,-58380,"[imageOf 836, RAC Database]",Fer - Fernanda Laguna,digital image,Argentina,Argentinean,Contemporary,"""Private Collection (Buenos Aires, Argentina)""",Colección Bruzzone,CC-BY Roberto Macchiavelli,https://museosabiertos.org/dam/,https://museosabiertos.org/dam/AR-MA-Bruzzone-Cartonera-Fer-0836-00.jpg
837,AR-MA-Bruzzone-Cartonera-La-manoseada-0837-00.jpg,Eloísa Cartonera (Buenos Aires artist collective),La manoseada de Sergio Parra,,Libro hecho a mano,Libro con tapas de cartón conteniendo un cuento,21.5 cm x 16 cm,2003 (creation),"Colección Bruzzone (Buenos Aires, Argentina) Inv. 837",-34599,-58380,"[imageOf 837, RAC Database]",La manoseada de Sergio Parra,digital image,Argentina,Argentinean,Contemporary,"""Private Collection (Buenos Aires, Argentina)""",Colección Bruzzone,CC-BY Roberto Macchiavelli,https://museosabiertos.org/dam/,https://museosabiertos.org/dam/AR-MA-Bruzzone-Cartonera-La-manoseada-0837-00.jpg
834,AR-MA-Bruzzone-Cartonera-Literatura-Skin-0834-00.jpg,Eloísa Cartonera (Buenos Aires artist collective),Literatura Skin de Timo Berger,,Libro hecho a mano,Libro con tapas de cartón conteniendo nueve cuentos,23 cm x 16 cm,2003 (creation),"Colección Bruzzone (Buenos Aires, Argentina) Inv. 834",-34599,-58380,"[imageOf 834, RAC Database]",Literatura Skin de Timo Berger,digital image,Argentina,Argentinean,Contemporary,"""Private Collection (Buenos Aires, Argentina)""",Colección Bruzzone,CC-BY Roberto Macchiavelli,https://museosabiertos.org/dam/,https://museosabiertos.org/dam/AR-MA-Bruzzone-Cartonera-Literatura-Skin-0834-00.jpg
838,AR-MA-Bruzzone-Cartonera-Mil-Gotas-0838-00.jpg,Eloísa Cartonera (Buenos Aires artist collective),Mil Gotas de César Aira,,Libro hecho a mano,Libro con tapas de cartón conteniendo un cuento,22 cm x 16.5 cm,2003 (creation),"Colección Bruzzone (Buenos Aires, Argentina) Inv. 838",-34599,-58380,"[imageOf 838, RAC Database]",Mil Gotas de César Aira,digital image,Argentina,Argentinean,Contemporary,"""Private Collection (Buenos Aires, Argentina)""",Colección Bruzzone,CC-BY Roberto Macchiavelli,https://museosabiertos.org/dam/,https://museosabiertos.org/dam/AR-MA-Bruzzone-Cartonera-Mil-Gotas-0838-00.jpg
832,AR-MA-Bruzzone-Cartonera-Noches-Vacias-0832-00.jpg,Eloísa Cartonera (Buenos Aires artist collective),Noches Vacías de Cucurto,,Libro hecho a mano,Libro con tapas de cartón conteniendo un cuento,22.5 cm x 16 cm,2003 (creation),"Colección Bruzzone (Buenos Aires, Argentina) Inv. 832",-34599,-58380,"[imageOf 832, RAC Database]",Noches Vacías de Cucurto,digital image,Argentina,Argentinean,Contemporary,"""Private Collection (Buenos Aires, Argentina)""",Colección Bruzzone,CC-BY Roberto Macchiavelli,https://museosabiertos.org/dam/,https://museosabiertos.org/dam/AR-MA-Bruzzone-Cartonera-Noches-Vacias-0832-00.jpg
1229,AR-MA-Bruzzone-Cartonero-Alberto-Virgen-1229-00.jpg,Cartonero Alberto,Virgen,,Témpera sobre panel,Virgen con corazón y rosas,44 cm x 28.5 cm,ca. 1995- ca. 2010 (creation),"Colección Bruzzone (Buenos Aires, Argentina) Inv. 1229",-34599,-58380,"[imageOf 1229, RAC Database]",Virgen,digital image,Argentina,Argentinean,Contemporary,"""Private Collection (Buenos Aires, Argentina)""",Colección Bruzzone,CC-BY Roberto Macchiavelli,https://museosabiertos.org/dam/,https://museosabiertos.org/dam/AR-MA-Bruzzone-Cartonero-Alberto-Virgen-1229-00.jpg
1451,AR-MA-Bruzzone-Casa-de-la-Poesia-13-Librillos-de-Poesia-Ilustrados-1451-00.jpg,Casa de la Poesía (Argentinian artist collective),13 Librillos de Poesía Ilustrados,,Librillo,13 Librillos con poemas y tapas ilustradas,18 cm x 10 cm (each),2002 (creation),"Colección Bruzzone (Buenos Aires, Argentina) Inv. 1451",-34599,-58380,"[imageOf 1451, RAC Database]",13 Librillos de Poesía Ilustrados,digital image,Argentina,Argentinean,Contemporary,"""Private Collection (Buenos Aires, Argentina)""",Colección Bruzzone,CC-BY Roberto Macchiavelli,https://museosabiertos.org/dam/,https://museosabiertos.org/dam/AR-MA-Bruzzone-Casa-de-la-Poesia-13-Librillos-de-Poesia-Ilustrados-1451-00.jpg
1234,AR-MA-Bruzzone-Castellani-Lujan-Tarjetas-1234-00.jpg,"Castellani, Luján",Tarjetas,,Impreso sobre papel,"Cuatro tarjetas con fotos impresas, con luces como tema",56 cm x 21 cm; 11 cm x 15.5 cm (each),2000 (creation),"Colección Bruzzone (Buenos Aires, Argentina) Inv. 1234",-34599,-58380,"[imageOf 1234, RAC Database]",Tarjetas,digital image,Argentina,Argentinean,Contemporary,"""Private Collection (Buenos Aires, Argentina)""",Colección Bruzzone,CC-BY Roberto Macchiavelli,https://museosabiertos.org/dam/,https://museosabiertos.org/dam/AR-MA-Bruzzone-Castellani-Lujan-Tarjetas-1234-00.jpg
1783,AR-MA-Bruzzone-Castellon-Arrieta-Gimena-Nada-me-une-a-mi-mismo-1783-00.jpg,"Castellón Arrieta, Gimena",Nada me une a mí mismo,,Librillo impreso. Tintas de impresión sobre papel. Tapas de cartón cocidas con hilo,Textos y fotografías,22 cm x 15 cm,ca. 1995- ca. 2010 (creation),"Colección Bruzzone (Buenos Aires, Argentina) Inv. 1783",-34599,-58380,"[imageOf 1783, RAC Database]",Nada me une a mí mismo,digital image,Argentina,Argentinean,Contemporary,"""Private Collection (Buenos Aires, Argentina)""",Colección Bruzzone,CC-BY Roberto Macchiavelli,https://museosabiertos.org/dam/,https://museosabiertos.org/dam/AR-MA-Bruzzone-Castellon-Arrieta-Gimena-Nada-me-une-a-mi-mismo-1783-00.jpg
1947,AR-MA-Bruzzone-Castro-Sofia-Sticker-18-1947-00.jpg,"Castro, Sofía",Sticker 18,,Acuarela sobre papel,"El General Don José de San Martín, tomándose la cabeza con la mano derecha",20 cm x 12.5 cm,2020 (creation),"Colección Bruzzone (Buenos Aires, Argentina) Inv. 1947",-34599,-58380,"[imageOf 1947, RAC Database]",Sticker 18,digital image,Argentina,Argentinean,Contemporary,"""Private Collection (Buenos Aires, Argentina)""",Colección Bruzzone,CC-BY Roberto Macchiavelli,https://museosabiertos.org/dam/,https://museosabiertos.org/dam/AR-MA-Bruzzone-Castro-Sofia-Sticker-18-1947-00.jpg
1227,AR-MA-Bruzzone-Catstudio-Towel-of-The-Geography-Collection-1227-00.jpg,Catstudio (Argentinian artist collective),Towel of The Geography Collection,,Screen print y bordado sobre tela,Imágenes y frases relacionada con Nueva York,72 cm x 52 cm,ca. 1995- ca. 2020 (creation),"Colección Bruzzone (Buenos Aires, Argentina) Inv. 1227",-34599,-58380,"[imageOf 1227, RAC Database]",Towel of The Geography Collection,digital image,Argentina,Argentinean,Contemporary,"""Private Collection (Buenos Aires, Argentina)""",Colección Bruzzone,CC-BY Roberto Macchiavelli,https://museosabiertos.org/dam/,https://museosabiertos.org/dam/AR-MA-Bruzzone-Catstudio-Towel-of-The-Geography-Collection-1227-00.jpg
1789,AR-MA-Bruzzone-Celoni-Pablo-Pinturas-1789-00.jpg,"Celoni, Pablo",Pinturas,,Oleo sobre tela. Tela montada sobre tablero,9 Pinturas de temas variados,9 cm x 14 cm (each),2001 (creation),"Colección Bruzzone (Buenos Aires, Argentina) Inv. 1789",-34599,-58380,"[imageOf 1789, RAC Database]",Pinturas,digital image,Argentina,Argentinean,Contemporary,"""Private Collection (Buenos Aires, Argentina)""",Colección Bruzzone,CC-BY Roberto Macchiavelli,https://museosabiertos.org/dam/,https://museosabiertos.org/dam/AR-MA-Bruzzone-Celoni-Pablo-Pinturas-1789-00.jpg
702,AR-MA-Bruzzone-Celoni-Tocandose-la-frente-0702-00.jpg,"Celoni, Pablo ",Sin título Tocándose la frente,,Mixta. Pastel y lápices sobre papel,"Un personaje tocándose la frente, a su alrededor formas con color",42 cm x 29 cm,ca. 1995- ca. 2010 (creation),"Colección Bruzzone (Buenos Aires, Argentina) Inv. 702",-34599,-58380,"[imageOf 702, RAC Database]",Sin título Tocándose la frente,digital image,Argentina,Argentinean,Contemporary,"""Private Collection (Buenos Aires, Argentina)""",Colección Bruzzone,CC-BY Roberto Macchiavelli,https://museosabiertos.org/dam/,https://museosabiertos.org/dam/AR-MA-Bruzzone-Celoni-Tocandose-la-frente-0702-00.jpg
770,AR-MA-Bruzzone-Centurion-Feliciano-Celebro-la-vida-0770-00.jpg,"Centurión, Feliciano ",Celebro la vida,,"Textil. Telas cosidas, pintadas  y bordadas","La frase del título al pié de un árbol con frutas, con fondo verde",137 cm x 97 cm,1996 (creation),"Colección Bruzzone (Buenos Aires, Argentina) Inv. 770",-34599,-58380,"[imageOf 770, RAC Database]",Celebro la vida,digital image,Argentina,Argentinean,Contemporary,"""Private Collection (Buenos Aires, Argentina)""",Colección Bruzzone,CC-BY Roberto Macchiavelli,https://museosabiertos.org/dam/,https://museosabiertos.org/dam/AR-MA-Bruzzone-Centurion-Feliciano-Celebro-la-vida-0770-00.jpg
1233,AR-MA-Bruzzone-Centurion-Feliciano-Seis-estrellas-1233-00.jpg,"Centurión, Feliciano ",Seis estrellas,,Textil. Telas cosidas y bordadas,Seis bordados sobre figuras de estrellas,51 cm x 43 cm,ca. 1995- ca. 2010 (creation),"Colección Bruzzone (Buenos Aires, Argentina) Inv. 1233",-34599,-58380,"[imageOf 1233, RAC Database]",Seis estrellas,digital image,Argentina,Argentinean,Contemporary,"""Private Collection (Buenos Aires, Argentina)""",Colección Bruzzone,CC-BY Roberto Macchiavelli,https://museosabiertos.org/dam/,https://museosabiertos.org/dam/AR-MA-Bruzzone-Centurion-Feliciano-Seis-estrellas-1233-00.jpg
769,AR-MA-Bruzzone-Centurion-Feliciano-Soy-Una-Fruta-Madura-en-la-naturaleza-viva-0769-00.jpg,"Centurión, Feliciano ",Soy Una Fruta Madura en la naturaleza viva,,"Textil. Telas cosidas, pintadas  y bordadas","La frase del título rodeada de frutas y hojas, con fondo verde",137 cm x 97 cm,1996 (creation),"Colección Bruzzone (Buenos Aires, Argentina) Inv. 769",-34599,-58380,"[imageOf 769, RAC Database]",Soy Una Fruta Madura en la naturaleza viva,digital image,Argentina,Argentinean,Contemporary,"""Private Collection (Buenos Aires, Argentina)""",Colección Bruzzone,CC-BY Roberto Macchiavelli,https://museosabiertos.org/dam/,https://museosabiertos.org/dam/AR-MA-Bruzzone-Centurion-Feliciano-Soy-Una-Fruta-Madura-en-la-naturaleza-viva-0769-00.jpg
504,AR-MA-Bruzzone-Centurion-Feliciano-Tu-Mirada-Me-Acompana-0504-00.jpg,"Centurión, Feliciano ",Tu Mirada Me Acompaña,,Textil. Telas cosidas y bordadas,Abstracción de un ojo y leyenda al pié,42 cm x 34 cm,1995 (creation),"Colección Bruzzone (Buenos Aires, Argentina) Inv. 504",-34599,-58380,"[imageOf 504, RAC Database]",Tu Mirada Me Acompaña,digital image,Argentina,Argentinean,Contemporary,"""Private Collection (Buenos Aires, Argentina)""",Colección Bruzzone,CC-BY Roberto Macchiavelli,https://museosabiertos.org/dam/,https://museosabiertos.org/dam/AR-MA-Bruzzone-Centurion-Feliciano-Tu-Mirada-Me-Acompana-0504-00.jpg
847,AR-MA-Bruzzone-Ceraso-Facundo-Abstracto-0847-00.jpg,"Ceraso, Facundo ",Sin título. Abstracto,,Pintura sobre tela,Abstracto predominando el color blanco y negro,50 cm x 50 cm,2012 (creation),"Colección Bruzzone (Buenos Aires, Argentina) Inv. 847",-34599,-58380,"[imageOf 847, RAC Database]",Sin título. Abstracto,digital image,Argentina,Argentinean,Contemporary,"""Private Collection (Buenos Aires, Argentina)""",Colección Bruzzone,CC-BY Roberto Macchiavelli,https://museosabiertos.org/dam/,https://museosabiertos.org/dam/AR-MA-Bruzzone-Ceraso-Facundo-Abstracto-0847-00.jpg
891,AR-MA-Bruzzone-Ceraso-Facundo-Diptico-negro-0891-00.jpg,"Ceraso, Facundo ",Sin título – Díptico negro,,Mixta sobre cartón,Abstracciones de caras sobre negro,40 cm x 168 cm; 40 cm x 100 cm (each) y 40 cm x 68 cm (each),2013 (creation),"Colección Bruzzone (Buenos Aires, Argentina) Inv. 891",-34599,-58380,"[imageOf 891, RAC Database]",Sin título – Díptico negro,digital image,Argentina,Argentinean,Contemporary,"""Private Collection (Buenos Aires, Argentina)""",Colección Bruzzone,CC-BY Roberto Macchiavelli,https://museosabiertos.org/dam/,https://museosabiertos.org/dam/AR-MA-Bruzzone-Ceraso-Facundo-Diptico-negro-0891-00.jpg
393,AR-MA-Bruzzone-Ceraso-Facundo-Fuck-City-0393-00.jpg,"Ceraso, Facundo ",Fuck City,,Tallado sobre papel pintado,Las palabras “Fuck City” con fondo blanco,27 cm x 38 cm,ca. 1995- ca. 2010 (creation),"Colección Bruzzone (Buenos Aires, Argentina) Inv. 393",-34599,-58380,"[imageOf 393, RAC Database]",Fuck City,digital image,Argentina,Argentinean,Contemporary,"""Private Collection (Buenos Aires, Argentina)""",Colección Bruzzone,CC-BY Roberto Macchiavelli,https://museosabiertos.org/dam/,https://museosabiertos.org/dam/AR-MA-Bruzzone-Ceraso-Facundo-Fuck-City-0393-00.jpg
1810,AR-MA-Bruzzone-Ceraso-Facundo-La-sonrisa-del-perro-1810-00.jpg,"Ceraso, Facundo",La sonrisa del perro,,"Mixta sobre tela. Látex, sintético, pastel seco","Abstracto con leyenda ""La sonrisa del perro""",160 cm x 130 cm,2019 (creation),"Colección Bruzzone (Buenos Aires, Argentina) Inv. 1810",-34599,-58380,"[imageOf 1810, RAC Database]",La sonrisa del perro,digital image,Argentina,Argentinean,Contemporary,"""Private Collection (Buenos Aires, Argentina)""",Colección Bruzzone,CC-BY Roberto Macchiavelli,https://museosabiertos.org/dam/,https://museosabiertos.org/dam/AR-MA-Bruzzone-Ceraso-Facundo-La-sonrisa-del-perro-1810-00.jpg
401,AR-MA-Bruzzone-Ceraso-Facundo-Piel-0401-00.jpg,"Ceraso, Facundo ",Piel,,Objeto,Piel tensada en un bastidor de madera,26 cm x 26 cm x 7 cm,ca. 1995- ca. 2010 (creation),"Colección Bruzzone (Buenos Aires, Argentina) Inv. 401",-34599,-58380,"[imageOf 401, RAC Database]",Piel,digital image,Argentina,Argentinean,Contemporary,"""Private Collection (Buenos Aires, Argentina)""",Colección Bruzzone,CC-BY Roberto Macchiavelli,https://museosabiertos.org/dam/,https://museosabiertos.org/dam/AR-MA-Bruzzone-Ceraso-Facundo-Piel-0401-00.jpg
10,AR-MA-Bruzzone-Ceraso-Facundo-Sin-Titulo-El-otro-orto-0010-00.jpg,"Ceraso, Facundo ",Sin Título-El otro orto,,Técnica mixta. Collage de diversos materiales y corrector y pintura sobre chapa,"Leyendas, dibujos, papeles cortados con formas, forrados con cinta adhesiva",52 cm x 50 cm,ca. 1995- ca. 2010 (creation),"Colección Bruzzone (Buenos Aires, Argentina) Inv. 10",-34599,-58380,"[imageOf 10, RAC Database]",Sin Título-El otro orto,digital image,Argentina,Argentinean,Contemporary,"""Private Collection (Buenos Aires, Argentina)""",Colección Bruzzone,CC-BY Roberto Macchiavelli,https://museosabiertos.org/dam/,https://museosabiertos.org/dam/AR-MA-Bruzzone-Ceraso-Facundo-Sin-Titulo-El-otro-orto-0010-00.jpg
1933,AR-MA-Bruzzone-Ceretti-Agustin-Gorro-1933-00.jpg,"Ceretti, Agustín",Gorro,,Textil. Objeto Intervenido. Bordado. Hilos. Tela,Un gorro con la palabra “Ceretti” bordada con hilos color rosa,25 cm (diameter) cm x 16 cm (height),ca. 1995- ca. 2010 (creation),"Colección Bruzzone (Buenos Aires, Argentina) Inv. 1933",-34599,-58380,"[imageOf 1933, RAC Database]",Gorro,digital image,Argentina,Argentinean,Contemporary,"""Private Collection (Buenos Aires, Argentina)""",Colección Bruzzone,CC-BY Roberto Macchiavelli,https://museosabiertos.org/dam/,https://museosabiertos.org/dam/AR-MA-Bruzzone-Ceretti-Agustin-Gorro-1933-00.jpg
1937,AR-MA-Bruzzone-Ceretti-Agustin-Sourvenir-1937-00.jpg,"Ceretti, Agustín",Sourvenir,,Acrílico sobre tablero de mdf. Chapa de acero. Tornillo y tuerca,Una bandera Argentina con moño en su esquina superior derecha y en el medio un sol en amarillo fuerte,48 cm x 75 cm,2019 (creation),"Colección Bruzzone (Buenos Aires, Argentina) Inv. 1937",-34599,-58380,"[imageOf 1937, RAC Database]",Sourvenir,digital image,Argentina,Argentinean,Contemporary,"""Private Collection (Buenos Aires, Argentina)""",Colección Bruzzone,CC-BY Roberto Macchiavelli,https://museosabiertos.org/dam/,https://museosabiertos.org/dam/AR-MA-Bruzzone-Ceretti-Agustin-Sourvenir-1937-00.jpg
967,AR-MA-Bruzzone-Cezar-Sergio-Rio-0967-00.jpg,"Cezar, Sergio",Rio,,Escultura. Técnica mixta,Morro con una favela,32.5 z 76 cm x 15.5 cm,2011 (creation),"Colección Bruzzone (Buenos Aires, Argentina) Inv. 967",-34599,-58380,"[imageOf 967, RAC Database]",Rio,digital image,Argentina,Argentinean,Contemporary,"""Private Collection (Buenos Aires, Argentina)""",Colección Bruzzone,CC-BY Roberto Macchiavelli,https://museosabiertos.org/dam/,https://museosabiertos.org/dam/AR-MA-Bruzzone-Cezar-Sergio-Rio-0967-00.jpg
85,AR-MA-Bruzzone-Chiachio-Giannone-Panda-y-Conejo-0085-00.jpg,"Chiachio, Leo; Giannone, Dany",Panda y Conejo,,Bordado sobre tela,"Dos personas disfrazadas de conejo y panda, con colibríes y flores alrededor",124 cm x 154 cm,2008 (creation),"Colección Bruzzone (Buenos Aires, Argentina) Inv. 85",-34599,-58380,"[imageOf 85, RAC Database]",Panda y Conejo,digital image,Argentina,Argentinean,Contemporary,"""Private Collection (Buenos Aires, Argentina)""",Colección Bruzzone,CC-BY Roberto Macchiavelli,https://museosabiertos.org/dam/,https://museosabiertos.org/dam/AR-MA-Bruzzone-Chiachio-Giannone-Panda-y-Conejo-0085-00.jpg
794,AR-MA-Bruzzone-Chiachio-Giannone-Ramona-2000-2010-0794-00.jpg,"Chiachio, Leo; Giannone, Dany",Ramona 2000 – 2010,,Bordado sobre tela,"Cubrecama bordado y calado con leyenda central “Ramona 2000 – 2010” y detalles de mariposas, picaflores y flores",approximately 230 cm x 170 cm,2010 (creation),"Colección Bruzzone (Buenos Aires, Argentina) Inv. 794",-34599,-58380,"[imageOf 794, RAC Database]",Ramona 2000 – 2010,digital image,Argentina,Argentinean,Contemporary,"""Private Collection (Buenos Aires, Argentina)""",Colección Bruzzone,CC-BY Roberto Macchiavelli,https://museosabiertos.org/dam/,https://museosabiertos.org/dam/AR-MA-Bruzzone-Chiachio-Giannone-Ramona-2000-2010-0794-00.jpg
1435,AR-MA-Bruzzone-Chiachio-Leo-ST-Cuerpo-ramificado-1435-00.jpg,"Chiachio, Leo ",Sin título. Cuerpo ramificado,,Impreso sobre papel. SerigrafÌa. Tinta de impresión negra,"Un cuerpo con ramas que salen de su torso y de sus genitales, con botas, pisando una canasta con una planta",34 cm x 20 cm,ca. 1995- ca. 2010 (creation),"Colección Bruzzone (Buenos Aires, Argentina) Inv. 1435",-34599,-58380,"[imageOf 1435, RAC Database]",Sin título. Cuerpo ramificado,digital image,Argentina,Argentinean,Contemporary,"""Private Collection (Buenos Aires, Argentina)""",Colección Bruzzone,CC-BY Roberto Macchiavelli,https://museosabiertos.org/dam/,https://museosabiertos.org/dam/AR-MA-Bruzzone-Chiachio-Leo-ST-Cuerpo-ramificado-1435-00.jpg
692,AR-MA-Bruzzone-Ciciliani-Agustin-Techo-fondo-celeste-0692-00.jpg,"Ciciliani, Agustín",Techo fondo celeste,,Fotografía sobre papel,Pared blanca con techo y fondo celeste,50 cm x 50 cm,ca. 1995- ca. 2010 (creation),"Colección Bruzzone (Buenos Aires, Argentina) Inv. 692",-34599,-58380,"[imageOf 692, RAC Database]",Techo fondo celeste,digital image,Argentina,Argentinean,Contemporary,"""Private Collection (Buenos Aires, Argentina)""",Colección Bruzzone,CC-BY Roberto Macchiavelli,https://museosabiertos.org/dam/,https://museosabiertos.org/dam/AR-MA-Bruzzone-Ciciliani-Agustin-Techo-fondo-celeste-0692-00.jpg
693,AR-MA-Bruzzone-Ciciliani-Agustin-Techo-fondo-verde-0693-00.jpg,"Ciciliani, Agustín",Techo fondo verde,,Fotografía sobre papel,Pared blanca con techo y fondo verde,50 cm x 50 cm,ca. 1995- ca. 2010 (creation),"Colección Bruzzone (Buenos Aires, Argentina) Inv. 693",-34599,-58380,"[imageOf 693, RAC Database]",Techo fondo verde,digital image,Argentina,Argentinean,Contemporary,"""Private Collection (Buenos Aires, Argentina)""",Colección Bruzzone,CC-BY Roberto Macchiavelli,https://museosabiertos.org/dam/,https://museosabiertos.org/dam/AR-MA-Bruzzone-Ciciliani-Agustin-Techo-fondo-verde-0693-00.jpg
950,AR-MA-Bruzzone-Cid-Fernanda-Flores-0950-00.jpg,"Cid, Fernanda",Flores,,Pintura sobre panel,Montañas llenas de flores con fondo negro,15 cm x 35 cm,2006 (creation),"Colección Bruzzone (Buenos Aires, Argentina) Inv. 950",-34599,-58380,"[imageOf 950, RAC Database]",Flores,digital image,Argentina,Argentinean,Contemporary,"""Private Collection (Buenos Aires, Argentina)""",Colección Bruzzone,CC-BY Roberto Macchiavelli,https://museosabiertos.org/dam/,https://museosabiertos.org/dam/AR-MA-Bruzzone-Cid-Fernanda-Flores-0950-00.jpg
1672,AR-MA-Bruzzone-Ciliberti-Florencia-Hana-Otras-Formas-2-1672-00.jpg,"Florencia Hana, Ciliberti",Otras Formas 2,,Grabación digital,14 Canciones,Box 13 cm x 13 cm; DVD 12 cm (diameter),2018 (creation),"Colección Bruzzone (Buenos Aires, Argentina) Inv. 1672",-34599,-58380,"[imageOf 1672, RAC Database]",Otras Formas 2,digital image,Argentina,Argentinean,Contemporary,"""Private Collection (Buenos Aires, Argentina)""",Colección Bruzzone,CC-BY Roberto Macchiavelli,https://museosabiertos.org/dam/,https://museosabiertos.org/dam/AR-MA-Bruzzone-Ciliberti-Florencia-Hana-Otras-Formas-2-1672-00.jpg
